{
  "schema": "expertcache.publication-artifact",
  "version": 1,
  "artifact_version": "0.2.0-dev",
  "state": "provisional",
  "title": "ExpertCache: Page-Aware Direct Expert Views for Oversized Sparse Models on Apple Silicon",
  "repository": "https://github.com/amos-labs/expertcache",
  "licenses": {
    "software": "Apache-2.0",
    "paper": "CC-BY-4.0"
  },
  "primary_model": {
    "id": "gpt-oss-120b-mxfp4",
    "repository": "ggml-org/gpt-oss-120b-GGUF",
    "revision": "238abdd290bb874b90a5da1b4549881b7d05c091",
    "filename": "gpt-oss-120b-MXFP4.gguf",
    "size_bytes": 63387346208
  },
  "secondary_models": [
    {
      "id": "gpt-oss-20b-mxfp4",
      "spec": "artifact/model-specs/gpt-oss-20b-mxfp4.json",
      "purpose": "same-family sparse-checkpoint portability control"
    }
  ],
  "claims": [
    {
      "id": "C1",
      "grade": "architecture-validated",
      "evidence": ["docs/EXPERT_CACHE_ZERO_COPY_RESULTS.md"]
    },
    {
      "id": "C2",
      "grade": "targeted-quality-validated",
      "evidence": [
        "docs/EXPERT_CACHE_ZERO_COPY_RESULTS.md",
        "evidence/qualification-controls-2026-07-31/"
      ]
    },
    {
      "id": "C3",
      "grade": "deterministic-equivalence-validated",
      "evidence": [
        "docs/EXPERT_CACHE_CEILING_RESULTS.md",
        "evidence/prefetch-2026-07-29/full-gate-qualification.json"
      ]
    },
    {
      "id": "C4",
      "grade": "decision-grade",
      "evidence": [
        "docs/EXPERT_CACHE_CEILING_RESULTS.md",
        "evidence/prefetch-2026-07-29/"
      ]
    },
    {
      "id": "C5",
      "grade": "decision-grade-synthetic",
      "evidence": ["evidence/grouped-dispatch-2026-07-29/"]
    }
  ],
  "gates": [
    {"id": "runtime-restored", "status": "complete"},
    {"id": "clean-64g-matrix", "status": "pending"},
    {"id": "full-quality-suite", "status": "pending"},
    {"id": "complete-resource-telemetry", "status": "pending"},
    {"id": "apple-silicon-32g", "status": "scoped-out"},
    {"id": "second-sparse-checkpoint", "status": "active"},
    {"id": "second-oversized-architecture", "status": "scoped-out"},
    {"id": "tagged-source-release", "status": "pending"}
  ],
  "bundle_include": [
    ".github",
    "AI_USAGE.md",
    "CITATION.cff",
    "CONTRIBUTING.md",
    "LICENSE",
    "NOTICE",
    "PROVENANCE.md",
    "README.md",
    "ROADMAP.md",
    "SECURITY.md",
    "artifact",
    "docs",
    "evidence",
    "harness",
    "package-lock.json",
    "package.json",
    "paper",
    "runtime",
    "scripts",
    "src",
    "test",
    "third_party"
  ]
}
